<?xml version='1.0' encoding='UTF-8'?>
<DnaXmlFormat xmlns:xsi="http://www.w3.org/2001/XMLSchema-instance" type="Station File" xsi:noNamespaceSchemaLocation="DynaML.xsd" referenceframe="GDA2020" epoch="01.01.2020">
  <DnaStation>
    <Name>327000199856</Name>
    <Constraints>FFC</Constraints>
    <Type>UTM</Type>
    <StationCoord>
      <Name>327000199856</Name>
      <XAxis>266590.8352</XAxis>
      <YAxis>5782831.0281</YAxis>
      <Height>0.0000</Height>
      <HemisphereZone>S55</HemisphereZone>
    </StationCoord>
  </DnaStation>
  <DnaStation>
    <Name>327000200130</Name>
    <Constraints>FFC</Constraints>
    <Type>UTM</Type>
    <StationCoord>
      <Name>327000200130</Name>
      <XAxis>266594.4766</XAxis>
      <YAxis>5782860.3525</YAxis>
      <Height>0.0000</Height>
      <HemisphereZone>S55</HemisphereZone>
    </StationCoord>
  </DnaStation>
  <DnaStation>
    <Name>327000200447</Name>
    <Constraints>FFC</Constraints>
    <Type>UTM</Type>
    <StationCoord>
      <Name>327000200447</Name>
      <XAxis>266599.4726</XAxis>
      <YAxis>5782864.0945</YAxis>
      <Height>0.0000</Height>
      <HemisphereZone>S55</HemisphereZone>
    </StationCoord>
  </DnaStation>
  <DnaStation>
    <Name>327000200835</Name>
    <Constraints>FFC</Constraints>
    <Type>UTM</Type>
    <StationCoord>
      <Name>327000200835</Name>
      <XAxis>266606.6443</XAxis>
      <YAxis>5782829.0209</YAxis>
      <Height>0.0000</Height>
      <HemisphereZone>S55</HemisphereZone>
    </StationCoord>
  </DnaStation>
  <DnaStation>
    <Name>327000201157</Name>
    <Constraints>FFC</Constraints>
    <Type>UTM</Type>
    <StationCoord>
      <Name>327000201157</Name>
      <XAxis>266610.6108</XAxis>
      <YAxis>5782862.7487</YAxis>
      <Height>0.0000</Height>
      <HemisphereZone>S55</HemisphereZone>
    </StationCoord>
  </DnaStation>
  <DnaStation>
    <Name>327000201926</Name>
    <Constraints>FFC</Constraints>
    <Type>UTM</Type>
    <StationCoord>
      <Name>327000201926</Name>
      <XAxis>266622.4093</XAxis>
      <YAxis>5782827.0212</YAxis>
      <Height>0.0000</Height>
      <HemisphereZone>S55</HemisphereZone>
    </StationCoord>
  </DnaStation>
  <DnaStation>
    <Name>327000202572</Name>
    <Constraints>FFC</Constraints>
    <Type>UTM</Type>
    <StationCoord>
      <Name>327000202572</Name>
      <XAxis>266626.5750</XAxis>
      <YAxis>5782860.8181</YAxis>
      <Height>0.0000</Height>
      <HemisphereZone>S55</HemisphereZone>
    </StationCoord>
  </DnaStation>
  <DnaStation>
    <Name>327000204449</Name>
    <Constraints>FFC</Constraints>
    <Type>UTM</Type>
    <StationCoord>
      <Name>327000204449</Name>
      <XAxis>266638.2263</XAxis>
      <YAxis>5782825.0130</YAxis>
      <Height>0.0000</Height>
      <HemisphereZone>S55</HemisphereZone>
    </StationCoord>
  </DnaStation>
  <DnaStation>
    <Name>327000205365</Name>
    <Constraints>FFC</Constraints>
    <Type>UTM</Type>
    <StationCoord>
      <Name>327000205365</Name>
      <XAxis>266642.3434</XAxis>
      <YAxis>5782858.9129</YAxis>
      <Height>0.0000</Height>
      <HemisphereZone>S55</HemisphereZone>
    </StationCoord>
  </DnaStation>
  <DnaStation>
    <Name>327000206876</Name>
    <Constraints>FFC</Constraints>
    <Type>UTM</Type>
    <StationCoord>
      <Name>327000206876</Name>
      <XAxis>266653.8291</XAxis>
      <YAxis>5782823.0331</YAxis>
      <Height>0.0000</Height>
      <HemisphereZone>S55</HemisphereZone>
    </StationCoord>
  </DnaStation>
  <DnaStation>
    <Name>327000207246</Name>
    <Constraints>FFC</Constraints>
    <Type>UTM</Type>
    <StationCoord>
      <Name>327000207246</Name>
      <XAxis>266658.1312</XAxis>
      <YAxis>5782857.0049</YAxis>
      <Height>0.0000</Height>
      <HemisphereZone>S55</HemisphereZone>
    </StationCoord>
  </DnaStation>
  <DnaStation>
    <Name>327500273624</Name>
    <Constraints>FFC</Constraints>
    <Type>UTM</Type>
    <StationCoord>
      <Name>327500273624</Name>
      <XAxis>266618.9543</XAxis>
      <YAxis>5782827.3973</YAxis>
      <Height>0.0000</Height>
      <HemisphereZone>S55</HemisphereZone>
    </StationCoord>
  </DnaStation>
  <DnaStation>
    <Name>327500273625</Name>
    <Constraints>FFC</Constraints>
    <Type>UTM</Type>
    <StationCoord>
      <Name>327500273625</Name>
      <XAxis>266618.9581</XAxis>
      <YAxis>5782827.4273</YAxis>
      <Height>0.0000</Height>
      <HemisphereZone>S55</HemisphereZone>
    </StationCoord>
  </DnaStation>
  <DnaStation>
    <Name>327500273626</Name>
    <Constraints>FFC</Constraints>
    <Type>UTM</Type>
    <StationCoord>
      <Name>327500273626</Name>
      <XAxis>266595.1108</XAxis>
      <YAxis>5782864.7506</YAxis>
      <Height>0.0000</Height>
      <HemisphereZone>S55</HemisphereZone>
    </StationCoord>
  </DnaStation>
</DnaXmlFormat>
