<?xml version="1.0"?>
<DnaXmlFormat type="Station File" referenceframe="GDA2020" epoch="01.01.2020" xmlns:xsi="http://www.w3.org/2001/XMLSchema-instance" xsi:noNamespaceSchemaLocation="DynaML.xsd">
  <DnaStation>
    <Name>ALIC</Name>
    <Constraints>CCC</Constraints>
    <Type>XYZ</Type>
    <StationCoord>
      <Name>ALIC</Name>
      <XAxis>-4052052.7379</XAxis>
      <YAxis>4212835.9824</YAxis>
      <Height>-2545104.5871</Height>
    </StationCoord>
    <Description>ALIC</Description>
  </DnaStation>
  <DnaStation>
    <Name>WARA</Name>
    <Constraints>FFF</Constraints>
    <Type>XYZ</Type>
    <StationCoord>
      <Name>WARA</Name>
      <XAxis>-3583757.5894</XAxis>
      <YAxis>4538446.7027</YAxis>
      <Height>-2683056.6932</Height>
    </StationCoord>
    <Description>WARA</Description>
  </DnaStation>
  <DnaStation>
    <Name>ADE1</Name>
    <Constraints>FFF</Constraints>
    <Type>XYZ</Type>
    <StationCoord>
      <Name>ADE1</Name>
      <XAxis>-3939182.8428</XAxis>
      <YAxis>3467075.3659</YAxis>
      <Height>-3613219.8375</Height>
    </StationCoord>
    <Description>ADE1</Description>
  </DnaStation>
</DnaXmlFormat>
