<?xml version="1.0"?>
<DnaXmlFormat type="Measurement File" referenceframe="GDA2020" epoch="01.01.2020" xmlns:xsi="http://www.w3.org/2001/XMLSchema-instance" xsi:noNamespaceSchemaLocation="DynaML.xsd">
  <DnaMeasurement>
    <Type>G</Type>
    <Source>CAMPAIGN_2023A</Source>
    <Ignore/>
    <ReferenceFrame>GDA2020</ReferenceFrame>
    <Epoch>01.01.2020</Epoch>
    <Vscale>1.000</Vscale>
    <Pscale>1.000</Pscale>
    <Lscale>1.000</Lscale>
    <Hscale>1.000</Hscale>
    <First>ALIC</First>
    <Second>WARA</Second>
    <GPSBaseline>
      <X>468295.1485</X>
      <Y>325610.7203</Y>
      <Z>-137952.1061</Z>
      <SigmaXX>1.7012598619e-005</SigmaXX>
      <SigmaXY>-1.0467927495e-005</SigmaXY>
      <SigmaXZ>1.4195195035e-005</SigmaXZ>
      <SigmaYY>9.4335882750e-006</SigmaYY>
      <SigmaYZ>-1.0196034054e-005</SigmaYZ>
      <SigmaZZ>1.4284143617e-005</SigmaZZ>
    </GPSBaseline>
  </DnaMeasurement>
  <DnaMeasurement>
    <Type>G</Type>
    <Source>CAMPAIGN_2023B</Source>
    <Ignore/>
    <ReferenceFrame>GDA2020</ReferenceFrame>
    <Epoch>01.01.2020</Epoch>
    <Vscale>1.000</Vscale>
    <Pscale>1.000</Pscale>
    <Lscale>1.000</Lscale>
    <Hscale>1.000</Hscale>
    <First>ALIC</First>
    <Second>ADE1</Second>
    <GPSBaseline>
      <X>112869.8951</X>
      <Y>-745760.6165</Y>
      <Z>-1068115.2504</Z>
      <SigmaXX>1.7457261805e-006</SigmaXX>
      <SigmaXY>-1.0335401280e-006</SigmaXY>
      <SigmaXZ>9.1178422963e-007</SigmaXZ>
      <SigmaYY>1.4855548902e-006</SigmaYY>
      <SigmaYZ>-8.8699137178e-007</SigmaYZ>
      <SigmaZZ>8.9829335174e-007</SigmaZZ>
    </GPSBaseline>
  </DnaMeasurement>
  <DnaMeasurement>
    <Type>G</Type>
    <Source></Source>
    <Ignore/>
    <ReferenceFrame>GDA2020</ReferenceFrame>
    <Epoch>01.01.2020</Epoch>
    <Vscale>1.000</Vscale>
    <Pscale>1.000</Pscale>
    <Lscale>1.000</Lscale>
    <Hscale>1.000</Hscale>
    <First>WARA</First>
    <Second>ADE1</Second>
    <GPSBaseline>
      <X>-355425.2534</X>
      <Y>-1071371.3368</Y>
      <Z>-930163.1443</Z>
      <SigmaXX>2.5012598619e-005</SigmaXX>
      <SigmaXY>-1.2467927495e-005</SigmaXY>
      <SigmaXZ>1.6195195035e-005</SigmaXZ>
      <SigmaYY>1.1433588275e-005</SigmaYY>
      <SigmaYZ>-1.2196034054e-005</SigmaYZ>
      <SigmaZZ>1.6284143617e-005</SigmaZZ>
    </GPSBaseline>
  </DnaMeasurement>
</DnaXmlFormat>
