<?xml version="1.0"?>
<DnaXmlFormat type="Measurement File" referenceframe="GDA2020" epoch="01.01.2020" xmlns:xsi="http://www.w3.org/2001/XMLSchema-instance" xsi:noNamespaceSchemaLocation="DynaML.xsd">
<!-- Created by:   dnaimport, File import and format exchange software -->
<!-- File type:    Measurement file -->
<!-- Project name: Sample measurements connected to ALIC and AU001 -->
<!-- Source files: SA_NGCA_20200706_msr.xml SA_SZS_20190521_msr.xml SA20200713_msr.xml  -->  
  <!-- Type (X) GPS baseline cluster (set of 2) -->
  <DnaMeasurement>
    <Type>X</Type>
    <Source></Source>
    <Ignore/>
    <ReferenceFrame>GDA2020</ReferenceFrame>
    <Epoch>01.01.2020</Epoch>
    <Vscale>26.334</Vscale>
    <Pscale>1.000</Pscale>
    <Lscale>1.000</Lscale>
    <Hscale>1.000</Hscale>
    <Total>2</Total>
    <First>5145/ 1020</First>
    <Second>ALIC</Second>
    <GPSBaseline>
      <X>-265741.1992</X>
      <Y>-75254.6860</Y>
      <Z>267691.6337</Z>
      <SigmaXX>3.1692911215074e-06</SigmaXX>
      <SigmaXY>-3.0189295562249e-06</SigmaXY>
      <SigmaXZ>1.8040563153590e-06</SigmaXZ>
      <SigmaYY>3.6084303774150e-06</SigmaYY>
      <SigmaYZ>-1.9983840440961e-06</SigmaYZ>
      <SigmaZZ>1.6272934642743e-06</SigmaZZ>
      <GPSCovariance>
        <m11>1.9785693970757e-06</m11>
        <m12>-1.9362240579981e-06</m12>
        <m13>1.1841269024510e-06</m13>
        <m21>-1.9312412228592e-06</m21>
        <m22>2.2898553689497e-06</m22>
        <m23>-1.3181086176743e-06</m23>
        <m31>1.1869579872882e-06</m31>
        <m32>-1.3263830801569e-06</m32>
        <m33>1.0671586707975e-06</m33>
      </GPSCovariance>
    </GPSBaseline>
    <First>5145/ 1020</First>
    <Second>WARA</Second>
    <GPSBaseline>
      <X>202553.9537</X>
      <Y>250356.0273</Y>
      <Z>129739.5309</Z>
      <SigmaXX>3.1524300462309e-06</SigmaXX>
      <SigmaXY>-3.1167951990447e-06</SigmaXY>
      <SigmaXZ>1.8614611111476e-06</SigmaXZ>
      <SigmaYY>3.8074723329251e-06</SigmaYY>
      <SigmaYZ>-2.1320534175385e-06</SigmaYZ>
      <SigmaZZ>1.6945695825399e-06</SigmaZZ>
    </GPSBaseline>
  </DnaMeasurement>
  <!-- Type (X) GPS baseline cluster (set of 3) -->
  <DnaMeasurement>
    <Type>X</Type>
    <Source></Source>
    <Ignore/>
    <ReferenceFrame>GDA2020</ReferenceFrame>
    <Epoch>01.01.2020</Epoch>
    <Vscale>21.061</Vscale>
    <Pscale>1.000</Pscale>
    <Lscale>1.000</Lscale>
    <Hscale>1.000</Hscale>
    <Total>3</Total>
    <First>5237/ 1004</First>
    <Second>4936/ 1009</Second>
    <GPSBaseline>
      <X>110399.0306</X>
      <Y>84575.0404</Y>
      <Z>-15067.3215</Z>
      <SigmaXX>6.9233761056271e-06</SigmaXX>
      <SigmaXY>-7.0296468447316e-06</SigmaXY>
      <SigmaXZ>5.0508066495701e-06</SigmaXZ>
      <SigmaYY>8.5103968220681e-06</SigmaYY>
      <SigmaYZ>-5.6723677598659e-06</SigmaYZ>
      <SigmaZZ>5.0314334159837e-06</SigmaZZ>
      <GPSCovariance>
        <m11>3.1659227664281e-06</m11>
        <m12>-3.1718355656881e-06</m12>
        <m13>2.2827466929588e-06</m13>
        <m21>-3.2010502472121e-06</m21>
        <m22>3.8213693568111e-06</m22>
        <m23>-2.5463949726556e-06</m23>
        <m31>2.2837508937488e-06</m31>
        <m32>-2.5212259771630e-06</m32>
        <m33>2.2429579863440e-06</m33>
      </GPSCovariance>
      <GPSCovariance>
        <m11>3.1862571385733e-06</m11>
        <m12>-3.2168075475174e-06</m12>
        <m13>2.2920390528121e-06</m13>
        <m21>-3.2352191213462e-06</m21>
        <m22>3.8932143972889e-06</m22>
        <m23>-2.5633452067864e-06</m23>
        <m31>2.2993416770459e-06</m31>
        <m32>-2.5546762090567e-06</m32>
        <m33>2.2532807810070e-06</m33>
      </GPSCovariance>
    </GPSBaseline>
    <First>5237/ 1004</First>
    <Second>ALIC</Second>
    <GPSBaseline>
      <X>-381049.3398</X>
      <Y>113423.4769</Y>
      <Z>669076.1793</Z>
      <SigmaXX>5.3507829701698e-06</SigmaXX>
      <SigmaXY>-5.1155919064744e-06</SigmaXY>
      <SigmaXZ>3.5457405468555e-06</SigmaXZ>
      <SigmaYY>6.0376419076352e-06</SigmaYY>
      <SigmaYZ>-3.8168553392316e-06</SigmaYZ>
      <SigmaZZ>3.3732941186705e-06</SigmaZZ>
      <GPSCovariance>
        <m11>3.9648197619218e-06</m11>
        <m12>-4.0656166403647e-06</m12>
        <m13>2.8237633319837e-06</m13>
        <m21>-3.9570893725201e-06</m21>
        <m22>4.7501198268852e-06</m22>
        <m23>-3.0794564131509e-06</m23>
        <m31>2.8174725421786e-06</m31>
        <m32>-3.1619681313492e-06</m32>
        <m33>2.6504174433878e-06</m33>
      </GPSCovariance>
    </GPSBaseline>
    <First>5237/ 1004</First>
    <Second>PERT</Second>
    <GPSBaseline>
      <X>1302315.3465</X>
      <Y>781904.2071</Y>
      <Z>-127614.2257</Z>
      <SigmaXX>5.2103396073406e-06</SigmaXX>
      <SigmaXY>-5.5714491933789e-06</SigmaXY>
      <SigmaXZ>3.7151261436950e-06</SigmaXZ>
      <SigmaYY>7.6888673603155e-06</SigmaYY>
      <SigmaYZ>-4.7307952136039e-06</SigmaYZ>
      <SigmaZZ>3.9549354435854e-06</SigmaZZ>
    </GPSBaseline>
  </DnaMeasurement>
  <!-- Type (X) GPS baseline cluster (set of 3) -->
  <DnaMeasurement>
    <Type>X</Type>
    <Source></Source>
    <Ignore/>
    <ReferenceFrame>GDA2020</ReferenceFrame>
    <Epoch>01.01.2020</Epoch>
    <Vscale>34.663</Vscale>
    <Pscale>1.000</Pscale>
    <Lscale>1.000</Lscale>
    <Hscale>1.000</Hscale>
    <Total>3</Total>
    <First>5035/ 1002</First>
    <Second>5736/ 1044</Second>
    <GPSBaseline>
      <X>-257315.3278</X>
      <Y>-177132.2020</Y>
      <Z>72229.4521</Z>
      <SigmaXX>4.9234645842511e-06</SigmaXX>
      <SigmaXY>-4.9476617405125e-06</SigmaXY>
      <SigmaXZ>3.5870089154201e-06</SigmaXZ>
      <SigmaYY>5.9422877363364e-06</SigmaYY>
      <SigmaYZ>-4.0075792893159e-06</SigmaYZ>
      <SigmaZZ>3.6216838067708e-06</SigmaZZ>
      <GPSCovariance>
        <m11>2.1543779076498e-06</m11>
        <m12>-2.2090181924519e-06</m12>
        <m13>1.5614892475095e-06</m13>
        <m21>-2.2204912680182e-06</m21>
        <m22>2.7192687935366e-06</m22>
        <m23>-1.7916043608116e-06</m23>
        <m31>1.5709218869882e-06</m31>
        <m32>-1.7978871990028e-06</m32>
        <m33>1.5723299808918e-06</m33>
      </GPSCovariance>
      <GPSCovariance>
        <m11>2.1389478433561e-06</m11>
        <m12>-2.2028922476030e-06</m12>
        <m13>1.5497212900702e-06</m13>
        <m21>-2.2105451805728e-06</m21>
        <m22>2.7098577274077e-06</m22>
        <m23>-1.7861330705486e-06</m23>
        <m31>1.5576179571336e-06</m31>
        <m32>-1.7891954217320e-06</m32>
        <m33>1.5611666604546e-06</m33>
      </GPSCovariance>
    </GPSBaseline>
    <First>5035/ 1002</First>
    <Second>ADE1</Second>
    <GPSBaseline>
      <X>-369600.5068</X>
      <Y>-647255.2497</Y>
      <Z>-305982.6306</Z>
      <SigmaXX>4.1175470246280e-06</SigmaXX>
      <SigmaXY>-3.8036107086400e-06</SigmaXY>
      <SigmaXZ>2.8795518103773e-06</SigmaXZ>
      <SigmaYY>4.4193284801433e-06</SigmaYY>
      <SigmaYZ>-2.9507324496927e-06</SigmaYZ>
      <SigmaZZ>2.8187922506569e-06</SigmaZZ>
      <GPSCovariance>
        <m11>2.5183962559475e-06</m11>
        <m12>-2.6368742844305e-06</m12>
        <m13>1.8280900737335e-06</m13>
        <m21>-2.6142920156305e-06</m21>
        <m22>3.2168253915378e-06</m22>
        <m23>-2.1095347085263e-06</m23>
        <m31>1.8123729275216e-06</m31>
        <m32>-2.0993368497363e-06</m32>
        <m33>1.7735637470013e-06</m33>
      </GPSCovariance>
    </GPSBaseline>
    <First>5035/ 1002</First>
    <Second>ALIC</Second>
    <GPSBaseline>
      <X>-482470.3938</X>
      <Y>98505.3647</Y>
      <Z>762132.6188</Z>
      <SigmaXX>3.4617613665480e-06</SigmaXX>
      <SigmaXY>-3.4655478934442e-06</SigmaXY>
      <SigmaXZ>2.3110728927928e-06</SigmaXZ>
      <SigmaYY>4.2385605091455e-06</SigmaYY>
      <SigmaYZ>-2.6188518390351e-06</SigmaYZ>
      <SigmaZZ>2.2545453054134e-06</SigmaZZ>
    </GPSBaseline>
  </DnaMeasurement>
  <!-- Type (G) GPS baseline -->
  <DnaMeasurement>
    <Type>G</Type>
    <Source>SANEW</Source>
    <Ignore/>
    <ReferenceFrame>ITRF1992</ReferenceFrame>
    <Epoch>03.08.1992</Epoch>
    <Vscale>1.000</Vscale>
    <Pscale>100.000</Pscale>
    <Lscale>100.000</Lscale>
    <Hscale>200.000</Hscale>
    <First>ALIC</First>
    <Second>AU001</Second>
    <GPSBaseline>
      <X>2981.7290</X>
      <Y>-2666.8400</Y>
      <Z>-9000.4630</Z>
      <SigmaXX>1.7457261805000e-06</SigmaXX>
      <SigmaXY>-1.0335401280000e-06</SigmaXY>
      <SigmaXZ>9.1178422963000e-07</SigmaXZ>
      <SigmaYY>1.4855548902000e-06</SigmaYY>
      <SigmaYZ>-8.8699137178000e-07</SigmaYZ>
      <SigmaZZ>8.9829335174000e-07</SigmaZZ>
    </GPSBaseline>
  </DnaMeasurement>
</DnaXmlFormat>
